{
  "schema_version": 2,
  "product": "chematic",
  "release": {
    "version": "1.0.23",
    "tag": "v1.0.23",
    "commit": null,
    "commit_source": "The attached GitHub Release asset is generated from the exact v1.0.23 tag commit.",
    "released_at": "2026-09-24T00:00:00+09:00"
  },
  "evidence_context": {
    "stable_release": {"version": "1.0.23", "tag": "v1.0.23", "commit": null},
    "candidate": null,
    "oracle_lanes": [
      {"engine": "RDKit", "version": "2025.09.3", "role": "pinned_regression", "status": "active"},
      {"engine": "RDKit", "version": "2026.03.6", "role": "separate_comparison", "status": "active"}
    ],
    "measurement_version_policy": "Measurements retain their recorded source, artifact, corpus, and comparator version; a new release does not relabel earlier evidence."
  },
  "packages": {
    "rust": {"name": "chematic", "version": "1.0.23", "registry_url": "https://crates.io/crates/chematic/1.0.23"},
    "python": {"name": "chematic", "version": "1.0.23", "registry_url": "https://pypi.org/project/chematic/1.0.23/"},
    "npm": {"name": "@kent-tokyo/chematic", "version": "1.0.23", "registry_url": "https://www.npmjs.com/package/@kent-tokyo/chematic/v/1.0.23"}
  },
  "wasm": {
    "artifact": "crates/chematic-wasm/pkg/chematic_wasm_bg.wasm",
    "measurements": [
      {"status": "historical", "release_or_snapshot": "v1.0.2 release candidate", "raw_bytes": 3300452, "compressed_bytes": 1213008, "command": "wasm-pack 0.13.1; wasm-opt 130 -O3; gzip -9", "runtime": "macOS arm64", "source": "benchmarks/2026-09-04-wasm-size.md"}
    ]
  },
  "mcp": {"tool_count": 20, "transport": ["stdio"], "network_enabled_tools": ["pubchem_lookup"]},
  "benchmarks": {"historical": [
    {"path": "benchmarks/2026-09-04-wasm-size.md", "status": "historical", "versions": ["v1.0.2 release candidate"], "commit": "not recorded in the source benchmark", "corpus": "optimized chematic WASM artifact", "hardware": "macOS arm64"},
    {"path": "benchmarks/2026-09-04-streaming-formats.md", "status": "historical", "versions": ["chematic 1.0.3", "RDKit 2025.09.3"], "commit": "not recorded in the source benchmark", "corpus": "checked-in two-record SDF and two-frame XYZ fixtures", "hardware": "macOS arm64"},
    {"path": "benchmarks/2026-09-24-python-op-matrix-vs-rdkit-perf-branch.md", "status": "historical", "versions": ["source 8cc01365", "RDKit 2026.03.6"], "commit": "8cc01365", "corpus": "5,000-molecule ChEMBL corpus", "hardware": "shared 2-vCPU x86 Linux VM"},
    {"path": "benchmarks/2026-09-24-rdkit-agreement-accuracy-branch.md", "status": "historical", "versions": ["source ea967d47", "RDKit 2026.03.6"], "commit": "ea967d476fa787bde64d001e752eb5cca0705b14", "corpus": "three versioned source lanes of up to 5,000 rows", "hardware": "shared 2-vCPU x86 Linux VM"}
  ]},
  "generated_at": "2026-09-24T00:00:00+09:00"
}
